StartDate,EndDate,Status,IPAddress,Progress,Duration (in seconds),Finished,RecordedDate,ResponseId,RecipientLastName,RecipientFirstName,RecipientEmail,ExternalReference,LocationLatitude,LocationLongitude,DistributionChannel,UserLanguage,Q287,Prolific_ID,Qtest1,Qtest2,Qtest3,T1_W1_Decision,T1_W1_ERD_1,T1_W1_Prob_1,T1_W2_Decision,T1_W3_Decision,T1_W3_ERD_1,T1_W3_Prob_1,T1_W4_Decision,T1_W5_Decision,T1_Trust,T1_Competent,T1_Benevolent,T1_Predictable,T1_Responsibility,T2_W1_Decision,T2_W1_ERD_1,T2_W1_Prob_1,T2_W2_Decision,T2_W3_Decision,T2_W3_ERD_1,T2_W3_Prob_1,T2_W4_Decision,T3_W1_Decision,T3_W1_ERD_1,T3_W1_Prob_1,T3_W2_Decision,T3_W3_Decision,T3_W3_ERD_1,T3_W3_Prob_1,T3_W4_Decision,T3_W5_Decision,T3_Trust,T3_Competent,T3_Benevolent,T3_Predictable,T3_Responsability,T4_W1_Decision,T4_W1_ERD_1,T4_W1_Prob_1,T4_W2_Decision,T4_W3_Decision,T4_W3_ERD_1,T4_W3_Prob_1,T4_W4_Decision,T4_W5_Decision,T5_W1_Decision,T5_W1_ERD_1,T5_W1_Prob_1,T5_W2_Decision,T5_W3_Decision,T5_W3_ERD_1,T5_W3_Prob_1,T5_W4_Decision,T5_W5_Decision,T6_W1_Decision,T6_W1_ERD_1,T6_W1_Prob_1,T6_W2_Decision,T6_W3_Decision,T6_W3_ERD_1,T6_W3_Prob_1,T6_W4_Decision,T6_W5_Decision,T6_Trust,T6_Competent,T6_Benevolent,T6_Predictable,T6_Responsibility,T7_W1_Decision,T7_W1_ERD_1,T7_W1_Prob_1,T7_W2_Decision,T7_W3_Decision,T7_W3_ERD_1,T7_W3_Prob_1,T7_W4_Decision,T7_W5_Decision,Satisfaction,Work_again,age,gender,education,income,experience,WS1,WS2,TotalBonus,Create New Field or Choose From Dropdown...,Drug0,SW_cost0,Drug1,Drug2,Drug3,Drug4,Drug5,Drug6,Drug7,Drug8,Drug9,Runway0,Drug10,TotalBonusPrint,sw_cost1,sw_cost2,sw_cost3,sw_cost4,sw_cost5,sw_cost6,MTurkCode,PROLIFIC_PID
Start Date,End Date,Response Type,IP Address,Progress,Duration (in seconds),Finished,Recorded Date,Response ID,Recipient Last Name,Recipient First Name,Recipient Email,External Data Reference,Location Latitude,Location Longitude,Distribution Channel,User Language,"Consent form:

 
Northeastern University, Department of Computer Science

Name of Investigator(s): Stacy Marsella, Nutchanon Yongsatianchot

Title of Project: Human AI Collaboration

Sponsor: National Science Foundation

 

Request to Participate in Research

We would like to invite you to take part in a web-based research project. The purpose of this research is to study how people make decisions and work with Artificial Intelligence (AI)/robots or human collaborators in various search and delivery situations.

 

You must be at least 18 years old to be in this research project.

The study will take place at your own computer and will take about 25 minutes. If you decide to take part in this study, we will ask you to fill out a survey and play a game about making decisions and working with either a robot or a human.

There are no foreseeable risks or discomforts to you for taking part in this study.

There are no direct benefits to you for participating in the study. However, your answers may help us to learn more about how people make decisions and work with robots or human collaborators in various search and deliver situations.

Your part in this study will be handled in a confidential manner. Only the researchers will know that you participated in this study. Any reports or publications based on this research will use only group data and will not identify you or any individual as being of this project.

It is possible that respondents could be identified by the IP address or other electronic record associated with the response. Neither the researcher nor anyone involved with this survey will be capturing those data. The only individually-identifying data we receive from your crowdsourcing platform or panel is your unique identifier and your country. Your data are also stored on your platform or panel’s servers, and the data there are subject to their respective Privacy Notice and Participation Agreements.

If you have any questions regarding electronic privacy, please feel free to contact Northeastern University’s Office of Information Security via phone at 617-373-7901, or via email at privacy@neu.edu.

The decision to participate in this research project is up to you. You do not have to participate and you can refuse to answer any question. Even if you begin the study, you may withdraw at any time. If you do not complete the task payment will not be made.

You will be paid according to your crowdsourcing platform or panel’s reward guidelines for completing the task.

If you have any questions about this study, please feel free to contact Nutchanon Yongsatianchot (nutjung.nutlc@gmail.com), the person mainly responsible for the research. You can also contact Stacy Marsella (s.marsella@northeastern.edu), the Principal Investigator.

If you have any questions about your rights in this research, you may contact Nan C. Regina, Director, Human Subject Research Protection, Mail Stop: 560-177, 360 Huntington Avenue, Northeastern University, Boston, MA  02115. Tel:  617.373.4588, Email: n.regina@northeastern.edu. You may call anonymously if you wish.

This study has been reviewed and approved by the Northeastern University Institutional Review Board (#22-02-14).

 

I have read the consent form. By choosing the consent below, I give my consent to proceed with the study.",Please enter your Prolific ID:,"Based on the instruction above, what is the name of your primary supplier?","Based on the instruction above, as you get closer to running out of the drug, the cost of switching to [Field-WS2] ____.","Based on the instruction above, does [Field-WS1] know when you will run out of drugs?",Your decision:,When do you think [Field-WS1] will deliver the drug [Field-Drug2]? (The current week is 1.) - Week,How likely in percentage (%) do you think that [Field-WS1] will deliver the drug by week [Field-Runway0] (before you run out of the drug)? - By week [Field-Runway0],Your decision:,Your decision:,When do you think [Field-WS1] will deliver the drug [Field-Drug2]? (The current week is 3.) - Week,How likely in percentage (%) do you think that [Field-WS1] will deliver the drug by week [Field-Runway0] (before you run out of the drug)? - By week [Field-Runway0],Your decision:,Your decision:,How much do you trust [Field-WS1] to deliver the product on time?,How competent [Field-WS1] is in delivering drugs as promised?,How much do you think [Field-WS1] act in the best interests of you?,How predictive are [Field-WS1]'s ERD messages?,How much do you think [Field-WS1] is in control of when to deliver the products during shortages?,Your decision:,When do you think [Field-WS1] will deliver the drug [Field-Drug1]? (The current week is 1.) - Week,How likely in percentage (%) do you think that [Field-WS1] will deliver the drug by week [Field-Runway0] (before you run out of the drug)? - By week [Field-Runway0],Your decision:,Your decision:,When do you think [Field-WS1] will deliver the drug [Field-Drug1]? (The current week is 3.) - Week,How likely in percentage (%) do you think that [Field-WS1] will deliver the drug by week [Field-Runway0] (before you run out of the drug)? - By week [Field-Runway0],Your decision:,Your decision:,When do you think [Field-WS1] will deliver the drug [Field-Drug0]? (The current week is 1.) - Week,How likely in percentage (%) do you think that [Field-WS1] will deliver the drug by week [Field-Runway0] (before you run out of the drug)? - By week [Field-Runway0],Your decision:,Your decision:,When do you think [Field-WS1] will deliver the drug [Field-Drug0]? (The current week is 3.) - Week,How likely in percentage (%) do you think that [Field-WS1] will deliver the drug by week [Field-Runway0] (before you run out of the drug)? - By week [Field-Runway0],Your decision:,Your decision:,How much do you trust [Field-WS1] to deliver the product on time?,How competent [Field-WS1] is in delivering drugs as promised?,How much do you think [Field-WS1] act in the best interests of you?,How predictive are [Field-WS1]'s ERD messages?,How much do you think [Field-WS1] is in control of when to deliver the products during shortages?,Your decision:,When do you think [Field-WS1] will deliver the drug [Field-Drug3]? (The current week is 1.) - Week,How likely in percentage (%) do you think that [Field-WS1] will deliver the drug by week [Field-Runway0] (before you run out of the drug)? - By week [Field-Runway0],Your decision:,Your decision:,When do you think [Field-WS1] will deliver the drug [Field-Drug3]? (The current week is 3). - Week,How likely in percentage (%) do you think that [Field-WS1] will deliver the drug by week [Field-Runway0] (before you run out of the drug)? - By week [Field-Runway0],Your decision:,Your decision:,Your decision:,When do you think [Field-WS1] will deliver the drug [Field-Drug4]? (The current week is 1). - Week,How likely in percentage (%) do you think that [Field-WS1] will deliver the drug by week [Field-Runway0] (before you run out of the drug)? - By week [Field-Runway0],Your decision:,Your decision:,When do you think [Field-WS1] will deliver the drug [Field-Drug4]? (The current week is 3)? - Week,How likely in percentage (%) do you think that [Field-WS1] will deliver the drug by week [Field-Runway0] (before you run out of the drug)? - By week [Field-Runway0],Your decision:,Your decision:,Your decision:,When do you think [Field-WS1] will deliver the drug [Field-Drug5]? (The current week is 1). - Week,How likely in percentage (%) do you think that [Field-WS1] will deliver the drug by week [Field-Runway0] (before you run out of the drug)? - By week [Field-Runway0],Your decision:,Your decision:,When do you think [Field-WS1] will deliver the drug [Field-Drug5]? (The current week is 3)? - Week,How likely in percentage (%) do you think that [Field-WS1] will deliver the drug by week [Field-Runway0] (before you run out of the drug)? - By week [Field-Runway0],Your decision:,Your decision:,How much do you trust [Field-WS1] to deliver the product on time?,How competent [Field-WS1] is in delivering drugs as promised?,How much do you think [Field-WS1] act in the best interests of you?,How predictive are [Field-WS1]'s ERD messages?,How much do you think [Field-WS1] is in control of when to deliver the products during shortages?,Your decision:,When do you think [Field-WS1] will deliver the drug [Field-Drug6]? (The current week is 1). - Week,How likely in percentage (%) do you think that [Field-WS1] will deliver the drug by week [Field-Runway0] (before you run out of the drug)? - By week [Field-Runway0],Your decision:,Your decision:,When do you think [Field-WS1] will deliver the drug [Field-Drug6]? (The current week is 3)? - Week,How likely in percentage (%) do you think that [Field-WS1] will deliver the drug by week [Field-Runway0] (before you run out of the drug)? - By week [Field-Runway0],Your decision:,Your decision:,Please rate your satisfaction working with [Field-WS1],Would you like to work with [Field-WS1] again for future orders?,"How old are you, in years?",What's your gender?,Please indicate your highest level of education:,Please select the option that best describes your total yearly household income:,Have you ever had a job where you were responsible for managing inventory?,WS1,WS2,TotalBonus,Create New Field or Choose From Dropdown...,Drug0,SW_cost0,Drug1,Drug2,Drug3,Drug4,Drug5,Drug6,Drug7,Drug8,Drug9,Runway0,Drug10,TotalBonusPrint,sw_cost1,sw_cost2,sw_cost3,sw_cost4,sw_cost5,sw_cost6,MTurkCode,PROLIFIC_PID
"{""ImportId"":""startDate"",""timeZone"":""America/Denver""}","{""ImportId"":""endDate"",""timeZone"":""America/Denver""}","{""ImportId"":""status""}","{""ImportId"":""ipAddress""}","{""ImportId"":""progress""}","{""ImportId"":""duration""}","{""ImportId"":""finished""}","{""ImportId"":""recordedDate"",""timeZone"":""America/Denver""}","{""ImportId"":""_recordId""}","{""ImportId"":""recipientLastName""}","{""ImportId"":""recipientFirstName""}","{""ImportId"":""recipientEmail""}","{""ImportId"":""externalDataReference""}","{""ImportId"":""locationLatitude""}","{""ImportId"":""locationLongitude""}","{""ImportId"":""distributionChannel""}","{""ImportId"":""userLanguage""}","{""ImportId"":""QID622""}","{""ImportId"":""QID624_TEXT""}","{""ImportId"":""QID10""}","{""ImportId"":""QID11""}","{""ImportId"":""QID637""}","{""ImportId"":""QID395""}","{""ImportId"":""QID396_1""}","{""ImportId"":""QID397_1""}","{""ImportId"":""QID399""}","{""ImportId"":""QID402""}","{""ImportId"":""QID404_1""}","{""ImportId"":""QID405_1""}","{""ImportId"":""QID407""}","{""ImportId"":""QID410""}","{""ImportId"":""QID468""}","{""ImportId"":""QID469""}","{""ImportId"":""QID470""}","{""ImportId"":""QID471""}","{""ImportId"":""QID621""}","{""ImportId"":""QID364""}","{""ImportId"":""QID365_1""}","{""ImportId"":""QID366_1""}","{""ImportId"":""QID368""}","{""ImportId"":""QID371""}","{""ImportId"":""QID373_1""}","{""ImportId"":""QID374_1""}","{""ImportId"":""QID626""}","{""ImportId"":""QID118""}","{""ImportId"":""QID90_1""}","{""ImportId"":""QID91_1""}","{""ImportId"":""QID119""}","{""ImportId"":""QID347""}","{""ImportId"":""QID358_1""}","{""ImportId"":""QID359_1""}","{""ImportId"":""QID350""}","{""ImportId"":""QID630""}","{""ImportId"":""QID632""}","{""ImportId"":""QID633""}","{""ImportId"":""QID634""}","{""ImportId"":""QID635""}","{""ImportId"":""QID636""}","{""ImportId"":""QID420""}","{""ImportId"":""QID421_1""}","{""ImportId"":""QID422_1""}","{""ImportId"":""QID424""}","{""ImportId"":""QID427""}","{""ImportId"":""QID429_1""}","{""ImportId"":""QID430_1""}","{""ImportId"":""QID432""}","{""ImportId"":""QID435""}","{""ImportId"":""QID445""}","{""ImportId"":""QID446_1""}","{""ImportId"":""QID447_1""}","{""ImportId"":""QID449""}","{""ImportId"":""QID452""}","{""ImportId"":""QID454_1""}","{""ImportId"":""QID455_1""}","{""ImportId"":""QID457""}","{""ImportId"":""QID460""}","{""ImportId"":""QID491""}","{""ImportId"":""QID493_1""}","{""ImportId"":""QID494_1""}","{""ImportId"":""QID497""}","{""ImportId"":""QID501""}","{""ImportId"":""QID504_1""}","{""ImportId"":""QID505_1""}","{""ImportId"":""QID508""}","{""ImportId"":""QID512""}","{""ImportId"":""QID142""}","{""ImportId"":""QID143""}","{""ImportId"":""QID144""}","{""ImportId"":""QID145""}","{""ImportId"":""QID620""}","{""ImportId"":""QID525""}","{""ImportId"":""QID526_1""}","{""ImportId"":""QID527_1""}","{""ImportId"":""QID529""}","{""ImportId"":""QID532""}","{""ImportId"":""QID534_1""}","{""ImportId"":""QID535_1""}","{""ImportId"":""QID537""}","{""ImportId"":""QID540""}","{""ImportId"":""QID48""}","{""ImportId"":""QID22""}","{""ImportId"":""QID23_TEXT""}","{""ImportId"":""QID24""}","{""ImportId"":""QID25""}","{""ImportId"":""QID26""}","{""ImportId"":""QID27""}","{""ImportId"":""WS1""}","{""ImportId"":""WS2""}","{""ImportId"":""TotalBonus""}","{""ImportId"":""Create New Field or Choose From Dropdown...""}","{""ImportId"":""Drug0""}","{""ImportId"":""SW_cost0""}","{""ImportId"":""Drug1""}","{""ImportId"":""Drug2""}","{""ImportId"":""Drug3""}","{""ImportId"":""Drug4""}","{""ImportId"":""Drug5""}","{""ImportId"":""Drug6""}","{""ImportId"":""Drug7""}","{""ImportId"":""Drug8""}","{""ImportId"":""Drug9""}","{""ImportId"":""Runway0""}","{""ImportId"":""Drug10""}","{""ImportId"":""TotalBonusPrint""}","{""ImportId"":""sw_cost1""}","{""ImportId"":""sw_cost2""}","{""ImportId"":""sw_cost3""}","{""ImportId"":""sw_cost4""}","{""ImportId"":""sw_cost5""}","{""ImportId"":""sw_cost6""}","{""ImportId"":""MTurkCode""}","{""ImportId"":""PROLIFIC_PID""}"
2022-05-23 06:09:12,2022-05-23 06:19:28,IP Address,74.110.152.244,100,615,True,2022-05-23 06:19:28,R_ULUwLuUqdXE2qZ3,,,,,37.6239,-77.4309,anonymous,EN,I consent to taking part in this survey.,615364f140e3022941649b21,${e://Field/WS1},Goes up,No,[Wait] for the supply from ${e://Field/WS1},5,95,[Wait] for the supply from ${e://Field/WS1},[Wait] for the supply from ${e://Field/WS1},5,95,[Wait] for the supply from ${e://Field/WS1},[Wait] for the supply from ${e://Field/WS1},A moderate amount,A moderate amount,A moderate amount,A moderate amount,A moderate amount,[Wait] for the supply from ${e://Field/WS1},3,94,[Wait] for the supply from ${e://Field/WS1},[Wait] for the supply from ${e://Field/WS1},5,92,[Wait] for the supply from ${e://Field/WS1},[Wait] for the supply from ${e://Field/WS1},5,95,[Wait] for the supply from ${e://Field/WS1},[Wait] for the supply from ${e://Field/WS1},5,95,[Wait] for the supply from ${e://Field/WS1},[Wait] for the supply from ${e://Field/WS1},A little,A moderate amount,A little,A little,A little,[Wait] for the supply from ${e://Field/WS1},6,91,[Wait] for the supply from ${e://Field/WS1},[Wait] for the supply from ${e://Field/WS1},6,95,[Wait] for the supply from ${e://Field/WS1},[Switch] to ${e://Field/WS2} and receive the supply of the alternative drug next week. The cost of switching at this time is estimated to be $${e://Field/sw_cost5}.,[Switch] to ${e://Field/WS2} and receive the supply of the alternative drug next week. The cost of switching at this time is estimated to be $${e://Field/sw_cost1}.,7,19,,,7,10,,,[Switch] to ${e://Field/WS2} and receive the supply of the alternative drug next week. The cost of switching at this time is estimated to be $${e://Field/sw_cost1}.,7,49,,,8,40,,,None at all,A little,A little,A little,A little,[Wait] for the supply from ${e://Field/WS1},6,71,[Wait] for the supply from ${e://Field/WS1},[Wait] for the supply from ${e://Field/WS1},6,80,[Wait] for the supply from ${e://Field/WS1},[Wait] for the supply from ${e://Field/WS1},Somewhat dissatisfied,Neither likely nor unlikely,42,Male,4 year degree,"$100,000 to $150,000",Yes,Ackner Inc.,Belltree Corp.,610000,,T-97,0,B-23,E-11,J-37,P-05,R-91,S-41,W-53,Y-29,C-59,6,K-73,"610,000","20,000","24,000","30,000","38,000","50,000","100,000",2101192,615364f140e3022941649b21
2022-05-23 06:16:08,2022-05-23 06:30:51,IP Address,47.156.74.182,100,883,True,2022-05-23 06:30:52,R_3lQS4ABYBXdw2CT,,,,,34.2149,-119.1761,anonymous,EN,I consent to taking part in this survey.,5e2b0f49e0c1bf14ffba5b1b,${e://Field/WS1},Goes up,No,[Wait] for the supply from ${e://Field/WS1},2,79,[Switch] to ${e://Field/WS2} and receive the supply of the alternative drug next week. The cost of switching at this time is estimated to be $${e://Field/sw_cost2}.,,6,40,,,A little,A moderate amount,None at all,A moderate amount,A lot,[Switch] to ${e://Field/WS2} and receive the supply of the alternative drug next week. The cost of switching at this time is estimated to be $${e://Field/sw_cost1}.,6,50,,,6,70,,[Wait] for the supply from ${e://Field/WS1},6,71,[Wait] for the supply from ${e://Field/WS1},[Wait] for the supply from ${e://Field/WS1},6,71,[Wait] for the supply from ${e://Field/WS1},[Switch] to ${e://Field/WS2} and receive the supply of the alternative drug next week. The cost of switching at this time is estimated to be $${e://Field/sw_cost5}.,A moderate amount,A lot,A moderate amount,A little,A little,[Wait] for the supply from ${e://Field/WS1},6,41,[Wait] for the supply from ${e://Field/WS1},[Wait] for the supply from ${e://Field/WS1},5,39,[Wait] for the supply from ${e://Field/WS1},[Switch] to ${e://Field/WS2} and receive the supply of the alternative drug next week. The cost of switching at this time is estimated to be $${e://Field/sw_cost5}.,[Switch] to ${e://Field/WS2} and receive the supply of the alternative drug next week. The cost of switching at this time is estimated to be $${e://Field/sw_cost1}.,6,28,,,6,31,,,[Switch] to ${e://Field/WS2} and receive the supply of the alternative drug next week. The cost of switching at this time is estimated to be $${e://Field/sw_cost1}.,7,9,,,7,19,,,A little,A little,A little,A little,None at all,[Switch] to ${e://Field/WS2} and receive the supply of the alternative drug next week. The cost of switching at this time is estimated to be $${e://Field/sw_cost1}.,7,9,,,6,24,,,Somewhat dissatisfied,Somewhat unlikely,22,Female,High school graduate,"Less than $20,000",No,Ackner Inc.,Belltree Corp.,496000,,T-97,0,B-23,E-11,J-37,P-05,R-91,S-41,W-53,Y-29,C-59,6,K-73,"496,000","20,000","24,000","30,000","38,000","50,000","100,000",9413722,5e2b0f49e0c1bf14ffba5b1b
2022-05-23 06:13:34,2022-05-23 06:36:18,IP Address,71.167.233.175,100,1364,True,2022-05-23 06:36:19,R_1K41naUFQg98Nwx,,,,,40.6739,-73.9358,anonymous,EN,I consent to taking part in this survey.,58060d08b869700001d70b8c,${e://Field/WS1},Goes up,No,[Wait] for the supply from ${e://Field/WS1},5,64,[Wait] for the supply from ${e://Field/WS1},[Wait] for the supply from ${e://Field/WS1},5,60,[Switch] to ${e://Field/WS2} and receive the supply of the alternative drug next week. The cost of switching at this time is estimated to be $${e://Field/sw_cost4}.,,A moderate amount,A moderate amount,A lot,A moderate amount,A moderate amount,[Wait] for the supply from ${e://Field/WS1},4,76,[Wait] for the supply from ${e://Field/WS1},[Wait] for the supply from ${e://Field/WS1},5,63,[Wait] for the supply from ${e://Field/WS1},[Wait] for the supply from ${e://Field/WS1},5,82,[Wait] for the supply from ${e://Field/WS1},[Wait] for the supply from ${e://Field/WS1},5,66,[Wait] for the supply from ${e://Field/WS1},[Switch] to ${e://Field/WS2} and receive the supply of the alternative drug next week. The cost of switching at this time is estimated to be $${e://Field/sw_cost5}.,A moderate amount,A moderate amount,A moderate amount,A little,A moderate amount,[Wait] for the supply from ${e://Field/WS1},5,77,[Wait] for the supply from ${e://Field/WS1},[Wait] for the supply from ${e://Field/WS1},5,72,[Wait] for the supply from ${e://Field/WS1},[Wait] for the supply from ${e://Field/WS1},[Wait] for the supply from ${e://Field/WS1},5,46,[Wait] for the supply from ${e://Field/WS1},[Switch] to ${e://Field/WS2} and receive the supply of the alternative drug next week. The cost of switching at this time is estimated to be $${e://Field/sw_cost3}.,6,44,,,[Wait] for the supply from ${e://Field/WS1},6,40,[Switch] to ${e://Field/WS2} and receive the supply of the alternative drug next week. The cost of switching at this time is estimated to be $${e://Field/sw_cost2}.,,6,35,,,A little,A little,None at all,None at all,A little,[Wait] for the supply from ${e://Field/WS1},6,59,[Wait] for the supply from ${e://Field/WS1},[Wait] for the supply from ${e://Field/WS1},6,35,[Wait] for the supply from ${e://Field/WS1},[Wait] for the supply from ${e://Field/WS1},Neither satisfied nor dissatisfied,Neither likely nor unlikely,33,Male,2 year degree,"$100,000 to $150,000",Yes,Ackner Inc.,Belltree Corp.,458000,,T-97,0,B-23,E-11,J-37,P-05,R-91,S-41,W-53,Y-29,C-59,6,K-73,"458,000","20,000","24,000","30,000","38,000","50,000","100,000",2732458,58060d08b869700001d70b8c
2022-05-23 06:33:39,2022-05-23 06:44:21,IP Address,73.21.245.36,100,642,True,2022-05-23 06:44:21,R_2Vaw6Q3LxUK4Dku,,,,,29.1052,-82.0955,anonymous,EN,I consent to taking part in this survey.,5dbc46b70338051eb7999760,${e://Field/WS1},Goes up,No,[Wait] for the supply from ${e://Field/WS1},5,72,[Wait] for the supply from ${e://Field/WS1},[Wait] for the supply from ${e://Field/WS1},5,71,[Wait] for the supply from ${e://Field/WS1},[Wait] for the supply from ${e://Field/WS1},A lot,A lot,A lot,A lot,A great deal,[Wait] for the supply from ${e://Field/WS1},4,76,[Wait] for the supply from ${e://Field/WS1},[Wait] for the supply from ${e://Field/WS1},5,64,[Switch] to ${e://Field/WS2} and receive the supply of the alternative drug next week. The cost of switching at this time is estimated to be $${e://Field/sw_cost4}.,[Wait] for the supply from ${e://Field/WS1},4,79,[Wait] for the supply from ${e://Field/WS1},[Wait] for the supply from ${e://Field/WS1},5,61,[Wait] for the supply from ${e://Field/WS1},[Switch] to ${e://Field/WS2} and receive the supply of the alternative drug next week. The cost of switching at this time is estimated to be $${e://Field/sw_cost5}.,A moderate amount,A moderate amount,A moderate amount,A moderate amount,A moderate amount,[Switch] to ${e://Field/WS2} and receive the supply of the alternative drug next week. The cost of switching at this time is estimated to be $${e://Field/sw_cost1}.,5,39,,,6,32,,,[Switch] to ${e://Field/WS2} and receive the supply of the alternative drug next week. The cost of switching at this time is estimated to be $${e://Field/sw_cost1}.,7,39,,,7,52,,,[Switch] to ${e://Field/WS2} and receive the supply of the alternative drug next week. The cost of switching at this time is estimated to be $${e://Field/sw_cost1}.,7,22,,,7,23,,,None at all,None at all,None at all,None at all,None at all,[Wait] for the supply from ${e://Field/WS1},4,25,[Wait] for the supply from ${e://Field/WS1},[Wait] for the supply from ${e://Field/WS1},5,28,[Wait] for the supply from ${e://Field/WS1},[Switch] to ${e://Field/WS2} and receive the supply of the alternative drug next week. The cost of switching at this time is estimated to be $${e://Field/sw_cost5}.,Extremely dissatisfied,Extremely unlikely,44,Female,4 year degree,"$80,000 to $99,999",Yes,Ackner Inc.,Belltree Corp.,502000,,T-97,0,B-23,E-11,J-37,P-05,R-91,S-41,W-53,Y-29,C-59,6,K-73,"502,000","20,000","24,000","30,000","38,000","50,000","100,000",7800823,5dbc46b70338051eb7999760
